Source,PassageName,QuestionId,Question,A,B,C,D,E
worksheet,NOTRE DAME,3,"According to paragraph 2, what land-form is shaped like a cradle?",Paris of the fifteenth century,Paris at its birth,The old island of the City,The Seine,NULL
worksheet,NOTRE DAME,4,"During the time Paris was in its island state, what were ‘the Grand-Châtelet’ and ‘the Petit-Châtelet’?",Island states,Bridges,Bridge arches,Paris’ gates,NULL
worksheet,NOTRE DAME,5,"In paragraph 3, we learn that Paris ‘crossed the water’. What reason is given for this?",The kings of the first race declared it so.,The island was flooded.,Paris couldn’t be on the island.,The space Paris was occupying was insufficient.,NULL
worksheet,NOTRE DAME,6,"In paragraph 3, the author mentions an ‘ancient enclosure’. In the same paragraph, what is another way it is described?",The Grand and Petit-Châtelet,The first circle of walls and towers,The country,The two sides of the Seine,NULL
worksheet,NOTRE DAME,7,In which time did the ancient enclosure exist?,300 years ago,In the last century,In the nineteenth century,In the fifteenth century,NULL
worksheet,NOTRE DAME,8,"According to paragraph 4, how was the first circle of walls and towers worn away?",Slowly,Suddenly,Irregularly,Quietly,NULL
worksheet,NOTRE DAME,9,How do the houses stay within the ‘circular chain of great towers’ in paragraph 4?,"The houses are lofty and solid, so they can accommodate more people.","They have no choice, because Philip Augustus has imprisoned the citizens of Paris.",They build houses on top of the water.,The houses are squeezed into every space and grow taller.,NULL
worksheet,NOTRE DAME,10,"According to paragraph 4, why is there a rivalry between the construction of the houses?",The tallest houses are more prestigious.,The citizens want to be able to look down at their neighbours.,The view of Paris improves in proportion to how high the accommodation is.,It is only far above street level that there is space to breathe.,NULL
worksheet,NOTRE DAME,11,How long did the ‘dike’ made by Philip Augustus last before houses were built outside it?,Over 100 years,Over 1000 years,Until 1366,Until 1367,NULL
worksheet,NOTRE DAME,12,Why are the houses likened to ‘runaways’ in paragraph 5?,They are orderly and heedless of the wall.,They refuse to return to the inner city despite regulations.,They are built outside the wall enclosing the Paris of their time.,"They have gardens, allowing their inhabitants space to run free.",NULL
worksheet,NOTRE DAME,13,"‘The houses finally leap the wall of Philip Augustus, and scatter joyfully over the plain’ is an example of personification. What is personification?",A sequence of words beginning with the same initial sound,A direct address to the reader,Giving human characteristics to something non-human,An extended description,NULL
worksheet,NOTRE DAME,14,"According to paragraph 5, what type of city becomes a capital?",A city with modern walls,A city that on one occasion grows past its enclosure,A city that collects all the watersheds of a country,A city that continuously grows,NULL
worksheet,NOTRE DAME,15,Which of the following are capitals equated to in paragraph 5?,"Perpetually growing cities, funnels and gardens","Funnels, wells of civilization and sewers","Wells of civilization, watersheds and walls","Sap, life and the soul of a nation",NULL
worksheet,NOTRE DAME,16,Which of the following are given as examples of the soul a nation in paragraph 5?,"Commerce, cleverness and people","Industry, folly and population","Sap, life and filters","Knowledge, filters and masses",NULL
worksheet,NOTRE DAME,17,What fate did Charles V’s wall suffer?,A different fate to Philip Augustus’ wall,To be knocked down,To grow further into the suburbs,To be outgrown,NULL
worksheet,NOTRE DAME,18,"According to the last paragraph, which of the following describes Paris at the beginning of the fifteenth century?",Paris is contained within Charles V’s wall.,The suburbs of Paris run slightly past Charles V’s wall.,Paris contains four enclosures of walls.,Paris is famed for its hills.,NULL
worksheet,NOTRE DAME,19,Who is the king at the time the story is set to begin?,Philip Augustus,Charles V,Louis XI,Louis XV,NULL
worksheet,NOTRE DAME,20,"At the beginning of the fifteenth century, are the old enclosures of Paris still visible above the houses?",Only the ancient wall’s towers can be seen.,Several of the enclosures’ towers can be seen.,All the walls still look like new.,The towers that were built at the top of hills can be seen.,NULL
worksheet,NOTRE DAME,21,"According to the last paragraph, what type of change did Paris undergo between the beginning of the fifteenth century and the author’s time?",An intellectual change,A spiritual change,A visual change,No change aside from passing one more wall,NULL
worksheet,NOTRE DAME,22,What does the author think of Louis XV’s wall?,It is worthy of a kingly sum.,It is unimportant.,It is inexpensive and made of sensible materials.,It is dismal and detestable.,NULL
worksheet,NOTRE DAME,23,What does the author think of Louis XV?,Louis XV was unskilled at building walls.,Louis XV was miserly for using mud to build a wall.,Louis XV was an unhappy king.,Louis XV was a dreadful ruler.,NULL
worksheet,NOTRE DAME,24,"'The mighty city had cracked, in succession, its four enclosures of walls' What does the word succession mean in this context?",consequence,consecration,sequence,secular,NULL
worksheet,NOTRE DAME,25,"'Paris has undergone yet another transformation, unfortunately for our eyes' Which word best describes the attitude of the author in this quote?",optimistic,tolerant,scornful,sycophantic,NULL
worksheet,oliver twist -master,1,1) Why do you think Dickens described the master as fat and healthy?,To show how healthy the master is compared to the children,To highlight how unfair the master treats the boys...,To demonstrate how much the master eats compared to...,To show the master looks after himself better than...,NULL
worksheet,oliver twist -master,2,2) Why is Oliver described as a rebel for asking for more?,Because none of the boys wanted anymore,Because it is against the rules to ask for more,Because Dickens is using sarcasm here,Because rebels eat more when breaking the law,NULL
worksheet,oliver twist -master,3,3) “The master aimed a blow at Oliver’s head with the ladle; pinioned him in his arm; and shrieked aloud for the beadle.”...,The master hit Oliver and dragged him to the beadle,"The master hit Oliver, dragged him and shouted...","The master hit Oliver, restrained him and took him...","The master hit Oliver, restrained him and shouted...",NULL
worksheet,oliver twist -master,4,4) Which description best fits Mr. Bumble?,Violent and extreme,Cruel and mysterious,Mean and childish,Prophetic and pathetic,NULL
worksheet,oliver twist -master,5,5) What was Oliver’s punishment?,Hang himself,Solitary Confinement,Starvation,Kept in darkness,NULL
worksheet,oliver twist -master,7,6) Was Oliver’s punishment appropriate for what he done? What does it suggest about those who carried out the punishment?,NULL,NULL,NULL,NULL,NULL
worksheet,oliver twist -master,8,"7) “by tying one end of his pocket-handkerchief to a hook in the wall, and attaching himself to the other.” What is inferred...?",They wanted Oliver to entertain himself with the handkerchief,They wanted Oliver to make a lamp from the handkerchief,They wanted Oliver to keep himself warm with...,They wanted Oliver to hang himself with the handkerchief,NULL
worksheet,oliver twist -master,9,8) Why was Oliver not able to hang himself?,Handkerchiefs only belonged to rich people,Poor people were not allowed to have handkerchiefs,Poor people couldn’t afford any handkerchief,Oliver was too afraid to go through with it in the end,NULL
worksheet,oliver twist -master,10,9) Which best describes how Oliver felt in the room?,Afraid and alone,Cold and alone,Lost and afraid,Confused and hurt,NULL
worksheet,oliver twist -room,1,1) Which word in the sentence is a verb? “One or two women ladled the gruel at mealtimes.”,Women,Ladled,Gruel,Mealtimes,NULL
worksheet,oliver twist -room,2,2) Why did the bowls never need “washing”?,The boys cleaned their own bowls,The boys were so hungry they would eat every bit,The boys used their spoons to clean the bowls,The boys cleaned both their bowls and spoons,NULL
worksheet,oliver twist -room,3,3) What does “occasions of public rejoicing” mean?,NULL,NULL,NULL,NULL,NULL
worksheet,oliver twist -room,4,4) How long had the boys been starving for?,14 days,28 days,two months,Three months,NULL
worksheet,oliver twist -room,5,5) Which of these statements are true?,The master sat on the same side as the copper,The portions of gruel they boys received were small,The master made the boys polish their bowls...,The boys had voted Oliver to ask the master...,NULL
worksheet,oliver twist -room,6,6) Which of these statements are false?,The boys needed to encourage and hint at Oliver,The council was held the day before Oliver asked...,The only meal the boys had to eat was dinner*,The boys would receive bread on a day like...,NULL
worksheet,oliver twist -room,7,7) What reason best describes why the boys licked the fingers?,The food tasted so good that they wanted more,The boys did not want to waste any bit of...,The boys generally had excellent appetites,The boys did not have good table manners,NULL
worksheet,oliver twist -room,8,8) Why was the tall boy not used to “that sort of thing”?,He used to be surrounded by food,He grew faster than the other boys,He grew up eating more than once a day,He was starved longer than the rest of the boys,NULL
worksheet,oliver twist -room,9,9) What does it mean that a “council” was held?,The boys are part of an official organisation,The Master has selected a few boys to make...,The boys were simply chatting and discussing...,The boys were meeting to decide upon a matter,NULL
worksheet,oliver twist -room,10,10) What happened when the council was held?,Lots of boys showed up to discuss something,Lots of boys walked up to the master to ask for...,They cast votes on who should ask for more,They selected a boy at random to ask for more,NULL
worksheet,oliver twist -room,11,11) Why do you think they chose someone in this way?,The task was undesirable and risky,The task meant getting more food,The task involved a lot of work,The task needed to be given out fairly,NULL
worksheet,oliver twist -room,12,12) What effect is created by Dickens telling us the boys were hungry enough to eat each other?,It highlights the horrible situation the boys...,It highlights the horror of the novel,It highlights the mystery about what will happen...,It highlights the sarcasm in the author’s...,NULL
worksheet,oliver twist -room,13,13) What is the cook’s uniform?,A ladle,A hat and ladle,An apron,An apron and hat,NULL
worksheet,patagonia,1,What is suggested when the narrator says they “had been hourly expecting”?,They were waiting for something to happen...,Something happens every hour,They were checking something once an hour,They were expected to do something in an hour...,NULL
worksheet,patagonia,2,Which one of these phrases is a relative clause?,And I had been hourly expecting,"The tumbling, storm-vexed old steamer",In which I had taken passage,That tremendous tumult of waters,NULL
worksheet,patagonia,3,What effect is created when the writer says the boat is ‘groaning’?,It is tired and wants to sleep,It is in pain and struggling,It is upset and complaining,It is right about to snap,NULL
worksheet,patagonia,4,What made the boat seem like a living thing to the writer?,That it was working hard,That it had a heart,That it did not like working hard,The sounds and feelings,NULL
worksheet,patagonia,5,What does “it was as ugly to look at as it was said to be unsafe to voyage in” mean?,It is equally unsafe and ugly,It was ugly as it was unsafe,It was unsafe as it was ugly,The writer thinks unsafe boats are ugly,NULL
worksheet,patagonia,6,What mood is the writer trying to create in the second paragraph?,An unbearable and hellish nightmare...,"A hopeless, unwinnable and desperate situation",A tragic and melancholy situation,"A mysterious, creepy and ominous atmosphere",NULL
worksheet,patagonia,7,What word best replaces ‘perilous’ line XX?,Awful,Inadequate,Dangerous,Exhausting,NULL
worksheet,patagonia,8,Which one of these things is not mentioned about the boat?,It is very old,It was used by Vikings,It is an unusual boat,It has places to sleep on it,NULL
worksheet,patagonia,9,What does ‘succession of bumps’ mean?,A lot of bumps,Multiple bumps one after another,The bumps succeeded,The bumps made a pattern,NULL
worksheet,patagonia,10,Which one of these words would not describe the noise that woke up the writer?,Unpleasant,Satisfying,Ominous,Mystifying,NULL
worksheet,patagonia,11,Which of these words would not be used to describe the mate?,Selfish,Selfless,Untrustworthy,Dishonourable,NULL
worksheet,patagonia,12,What is another word for ‘perish’ line ____?,Die,Pray,Panic,Escape,NULL
worksheet,patagonia,13,What does the writer mean when they say “whose courage took another and better form”?,They are more courageous,They have a better plan,Their courage lets him confront the men,They are stronger and have a fitter form,NULL
worksheet,patagonia,14,Which description best summarises the Englishman with the gun?,"They are bold, brave and heroic",They are committed to doing the right thing,They want others to look up to them,They do not think it is actually an emergency,NULL
worksheet,patagonia,15,Which phrase highlights a sense of panic on the ship?,Slunk away and disappeared in the gloom,Streaming out onto the deck in a great state of alarm,Appeared like a ghost among us,The steamer got off the rocks and plunged on,NULL
worksheet,patagonia,16,How was the ship able to get into calmer waters?,An unlikely occurrence,The captain steered the ship,Everybody’s weight made the boat fall off the rocks,A bigger wave knocked it from the rocks,NULL
worksheet,patagonia,17,What writing technique is ‘milky surf’?,Metaphor,Simile,Personification,Exaggeration,NULL
worksheet,patagonia,18,What writing technique is used when the writer describes the sea as ‘seething’ line...?,Metaphor,Simile,Personification,Exaggeration,NULL
worksheet,patagonia,19,Which one of these statements is false?,The other mates were also Englishmen,The Englishman is the captain’s son,The first engineer was one of the men the writer...,The captain was close to dying,NULL
worksheet,peter,1,What is odd about the instructions Peter gave?,Even someone with a map would not understand,Birds would not even be able to use these instructions,The directions made no sense at all,The directions were outdated and were too confusing,NULL
worksheet,peter,2,Why did Peter give bad instructions?,He is an idiot,He doesn’t really know where he is going,He is keeping it secret,He blurts out random things,NULL
worksheet,peter,3,"What does it mean when it says “At first his companions trusted him implicitly,”",They trusted him completely,They partly trusted him,They trusted him temporarily,They did not really trust him,NULL
worksheet,peter,4,Why did Peter’s friends fly around the buildings?,They wanted to waste time,They enjoyed flying immediately,They wanted to test their skills,They had always wanted to do it,NULL
worksheet,peter,5,Why did they view themselves with contempt?,They thought highly of themselves only for doing something simple,They are embarrassed at how bad they were,They are shy about having to practise in front of Peter,They did not like how nervous they were when they first tried flying,NULL
worksheet,peter,6,Why does the narrator ask the reader a question? (line X),To emphasise that the characters have not kept track of time,To emphasise a lot of time has passed since they learnt to fly,To emphasise very little time has actually passed since they learned to fly,To make the reader try and recall how much time has passed,NULL
worksheet,peter,7,How does the atmosphere change once the author asks the reader a question?,The journey becomes more sinister,The situation becomes a bit worrying,The journey becomes too confusing,The situation becomes difficult to understand,NULL
worksheet,peter,8,What does “Sometimes it was dark and sometimes light” mean?,The sun’s light was being blocked by the sun,Time changed from daytime to nighttime,The weather was inconsistent and unpredictable,"When they fly, light works differently",NULL
worksheet,peter,9,How were the children fed?,They stole every piece of food from the birds?,They competed with birds for all their food,They had a back and forth for safe human food,They hunted birds,NULL
worksheet,peter,10,Which character seems the most sensible?,Peter,Wendy,Michael,John,NULL
worksheet,peter,11,Which of these options are TRUE?,They would hunt birds gaily for miles,Birds carrying maps would show them the way,John had a headstart on Michael,They learned how to fly around a room first,NULL
worksheet,peter,12,Which of these options are FALSE?,Peter is a smart boy,Peter told the instructions to Wendy,The birds hated the children for taking their food,Wendy was concerned about the journey,NULL
worksheet,peter,13,What caused the children to fall?,They would forget how to fly,They were falling asleep,They would bump into birds,Peter played pranks on them,NULL
worksheet,peter,14,What technique is “dropped like a stone” using?,Exaggeration,Simile,Personification,Metaphor,NULL
worksheet,peter,15,Why does the author call the sea “cruel” (line X),The sea is horrible to them,The sea would kill Michael,The sea is dangerous,The sea is a long way down,NULL
worksheet,peter,16,What was strange about the way Peter saved the children?,It was risky,It was selfish,It was wrong,It was ignorant,NULL
worksheet,peter,17,“Also he was fond of variety” What does this mean?,He liked having a lot of different things at once,He liked to change tasks infrequently,He liked to change what he was doing often,He liked a change of surroundings,NULL
worksheet,peter,18,How have the moods of the children changed?,At first they were having fun now they are scared,They are now finding Peter annoying,They are now planning on abandoning Peter,They are now planning on ignoring Peter,NULL
worksheet,pollyanna,1,What was abnormal about Miss Polly’s movements?,She was moving hastily,She was moving slower than usual,She was jittering,She was flourishing,NULL
worksheet,pollyanna,2,Why were Miss Polly’s movements considered unusual?,Nancy wants everything to be calm and quiet,Miss Polly was late,Miss Polly is normally relaxed and calm,We do not know enough about her,NULL
worksheet,pollyanna,3,"“But today, she was hurrying—actually hurrying” Why does the narrator separate part of the sentence?",To show Miss Polly was truly hurrying,To show the reader the situation is rushed,To highlight how surprised Nancy is,To help describe the setting better,NULL
worksheet,pollyanna,4,“Nancy had never “worked out” before;” Which of these statements are false?,This was the first time Nancy had worked,Nancy’s father did not work,Miss Polly was not always so stern,Nancy had three younger sisters,NULL
worksheet,pollyanna,5,Why did Nancy have to start working?,Her widowed mother required her to work,The bad situation meant she needed to work,She worked so she could take her mind off things,Working meant that she would not have to look after her siblings,NULL
worksheet,pollyanna,6,What does “but who never thought to smile even when knives and doors were still” suggest about Miss Polly?,Miss Polly is hard to impress,Miss Polly does not like Nancy’s work,Miss Polly is not pleased by things she expects,Miss Polly does not smile whilst she is working as it is unprofessional,NULL
worksheet,pollyanna,7,"“Sweep the room and clean it, of course, after you clear out the trunks and boxes."" Why does Miss Polly add ‘of course’ in her orders?",To sound more cross,To appear more bossy,To be more straightforward,To be rude and sarcastic,NULL
worksheet,pollyanna,8,What does Miss Polly think about having to take care of her niece?,She is overjoyed to spend time with her,She is nervous at the prospect,She considers it another job,She feels burdened by the prospect,NULL
worksheet,pollyanna,9,Why does Nancy ‘colour hotly’?,She is embarrassed,She is annoyed,She is confused,She is anxious,NULL
worksheet,pollyanna,10,Why was Nancy excited for Miss Polly to have her niece around?,Nancy was excited to have someone youthful around,Nancy would like another sister,Miss Polly would have been happier,It would make life more exciting and fun in the house,NULL
worksheet,pollyanna,11,What do we learn about Nancy from this sentence?,She is irresponsible and inattentive,She likes to do things for other people,She is caring and wants to help others,She ignores people’s feelings,NULL
worksheet,pollyanna,12,"““But, of course, you—you'd want her” What is happening in this line?",Nancy corrected herself just as she was about to say something rude,Nancy interrupted herself to say something Miss Polly would like,Miss Polly interrupted Nancy,Nancy is trying to convince Miss Polly that she needs Pollyanna,NULL
worksheet,pollyanna,13,Why is “HOPED” in capital letters (line X)?,For it to be read loudly,To emphasise the depth of her hope,To emphasise the topic of the sentence,It is the style of writing at the time,NULL
worksheet,pollyanna,14,What is another word for “remonstrances” (line X)?,Support,Circumstances,Reminders,Objection,NULL
worksheet,rebecca,1,What do we learn about the road from Maplewood to Riverboro?,That it is long and winding,That it is hot and messy,That it was hilly and grassy,That it is dry and arid,NULL
worksheet,rebecca,2,Which one statement best describes how Mr Jeremiah Cobb is feeling?,He is feeling happy,He is feeling relaxed,He is feeling overworked,He is feeling tired,NULL
worksheet,rebecca,3,What is the brim of the hat used for?,Covering eyes from the wind,Covering eyes when you need to sleep,Covering eyes from the dust,Covering eyes from the sun,NULL
worksheet,rebecca,4,Why was the dark-haired woman finding the journey difficult?,The land was uneven and caused the stagecoach to be bumpy,She was too small and light to sit comfortably,She is rich and not used to this form of transportation,The stagecoach was empty and so it was bumpier,NULL
worksheet,rebecca,5,What piece of information about the dark-haired lady is not mentioned?,What her body looks like,What she tried to do was regain balance,What she used to block out the sun’s light,What was in her purse,NULL
worksheet,rebecca,6,"What does “she looked whenever the condition of the roads would permit, finding great apparent satisfaction in that its precious contents neither disappeared nor grew less.” suggest the reason she looked into her purse was?",To check if everything in there was still fine,To check if there is more of whatever there is in there,To make herself happy by looking at it again,To ensure that it remains hidden in the purse,NULL
worksheet,rebecca,7,"What does “his business being to carry people to their destinations, not, necessarily, to make them comfortable on the way” tell us about the type of person Mr Cobb is?",He is not interested in their opinions,He is only interested in providing the best possible service,He goes above and beyond to get people to their destination,He is focused on doing his job and not on anything else,NULL
worksheet,rebecca,8,What word best replaces alighted line ______________,Lit up,Escaped,Got off,Set fire,NULL
worksheet,rebecca,9,How are the woman and the child feeling at the Riverboro stage?,Relieved,Urgent,Concerned,Astonished,NULL
worksheet,rebecca,10,What is unusual about the child?,She is eager,She is young,She is small for her size,She is by herself,NULL
worksheet,rebecca,11,"On line _______ the mother describes the daughter as excited, but another word may fit better there. Which word?",Exhausted,Amusing,Confused,Nervous,NULL
worksheet,rebecca,12,What does the mother’s laugh suggest about what she thinks about the daughter’s comments?,She thinks the journey is easy compared to the journey she just done is about to do,She thinks her daughter is just being stubborn and chatting back to her,She thinks her daughter is being proud for no reason,She thinks her daughter is being rude and laughs because she is embarrassed,NULL
worksheet,sea fever,1,"What writing technique is used here, “to the lonely sea and the sky”?",Metaphor,Simile,Personification,Allegory,NULL
worksheet,sea fever,2,Why do you think the poet calls the sea and sky lonely?,Because they are so big that nobody can ever fully explore them,"Because they are empty and not even filled with boats, clouds or stars",Because they are mysterious and nobody can ever understand them,All of the above,NULL
worksheet,sea fever,3,What does the phrase “all I ask” suggest?,They only need one thing,They have one question,They will never ask for anything again,All of the above,NULL
worksheet,sea fever,4,What effect is created when the poet writes “wind’s song”?,It makes the wind sound peaceful,It makes the wind sound more human and welcoming,It makes the wind sound creative but mysterious,It makes the wind sound happier and cheery,NULL
worksheet,sea fever,5,"In the first stanza, how many times did the poet use personification?",Three,Four,Five,Six,NULL
worksheet,sea fever,6,What word best describes the call of the tide?,Aggressive,Controlling,Persuasive,Disastrous,NULL
